<?xml version="1.0" encoding="UTF-8"?>
<xs:schema xmlns:xs="http://www.w3.org/2001/XMLSchema"
	targetNamespace="http://www.example.org/thermostat" xmlns="http://www.example.org/thermostat"
	elementFormDefault="qualified">
	<xs:element name="thermostatData">
		<xs:complexType>
			<xs:sequence>
				<xs:element name="dailyMeasurement" type="measurementType"
					minOccurs="0" maxOccurs="unbounded" />
				<xs:element name="model">
					<xs:complexType>
						<xs:attribute name="name" type="xs:string" />
					</xs:complexType>
				</xs:element>
				<xs:element name="user-ID" type="xs:string" />
			</xs:sequence>
		</xs:complexType>
	</xs:element>

	<xs:complexType name="measurementType">
		<xs:sequence>
			<xs:element name="date" type="xs:date" />
			<xs:element name="measurement" minOccurs="0" maxOccurs="unbounded">
				<xs:complexType>
					<xs:sequence>
						<xs:element name="temperature">
							<xs:complexType>
								<xs:sequence>
									<xs:element name="value" type="double" />
									<xs:element name="unit" type="xs:string" />
								</xs:sequence>
							</xs:complexType>
						</xs:element>
						<xs:element name="time-stamp" type="xs:time" />
						<xs:element name="humidity" type="xs:integer" />
					</xs:sequence>
				</xs:complexType>
			</xs:element>
		</xs:sequence>
	</xs:complexType>
	<xs:complexType name="double">
		<xs:sequence>
			<xs:element name="integer-part" type="xs:int" />
			<xs:element name="fraction-part" type="xs:int" />
		</xs:sequence>
	</xs:complexType>
</xs:schema>