<?xml version="1.0" encoding="UTF-8"?>
<t:thermostatData xmlns:t="http://www.example.org/thermostat"
	xmlns:xsi="http://www.w3.org/2001/XMLSchema-instance"
	xsi:schemaLocation="http://www.example.org/thermostat thermostat.xsd ">
	<t:dailyMeasurement>
		<t:date>2001-01-01</t:date>
		<t:measurement>
			<t:temperature>
				<t:value>
					<t:integer-part>10</t:integer-part>
					<t:fraction-part>20</t:fraction-part>
				</t:value>
				<t:unit>Centigrade</t:unit>
			</t:temperature>
			<t:time-stamp>12:00:00</t:time-stamp>
			<t:humidity>63</t:humidity>
		</t:measurement>
	</t:dailyMeasurement>
	<t:dailyMeasurement>
		<t:date>2001-01-01</t:date>
		<t:measurement>
		<t:temperature>
			<t:value>
				<t:integer-part>17</t:integer-part>
				<t:fraction-part>25</t:fraction-part>
			</t:value>
			<t:unit>Centigrade</t:unit>
		</t:temperature>
		<t:time-stamp>12:30:00</t:time-stamp>
		<t:humidity>73</t:humidity>
		</t:measurement>
	</t:dailyMeasurement>
	<t:dailyMeasurement>
		<t:date>2004-01-01</t:date>
		<t:measurement>
		   <t:temperature>
			<t:value>
				<t:integer-part>40</t:integer-part>
				<t:fraction-part>50</t:fraction-part>
			</t:value>
			<t:unit>Centigrade</t:unit>
		</t:temperature>
		<t:time-stamp>12:00:00</t:time-stamp>
		<t:humidity>53</t:humidity>
		</t:measurement>
	</t:dailyMeasurement>
	<t:dailyMeasurement>
		<t:date>2007-01-01</t:date>
		<t:measurement>
		<t:temperature>
			<t:value>
				<t:integer-part>30</t:integer-part>
				<t:fraction-part>10</t:fraction-part>
			</t:value>
			<t:unit>Centigrade</t:unit>
		</t:temperature>
		<t:time-stamp>12:00:00</t:time-stamp>
		<t:humidity>63</t:humidity>
		</t:measurement>
	</t:dailyMeasurement>
	<t:dailyMeasurement>
		<t:date>2007-01-01</t:date>
		<t:measurement>
			<t:temperature>
				<t:value>
					<t:integer-part>20</t:integer-part>
					<t:fraction-part>4</t:fraction-part>
				</t:value>
				<t:unit>Centigrade</t:unit>
			</t:temperature>
			<t:time-stamp>18:10:00</t:time-stamp>
			<t:humidity>73</t:humidity>
		</t:measurement>
	</t:dailyMeasurement>
	<t:dailyMeasurement>
		<t:date>2011-01-01</t:date>
		<t:measurement>
			<t:temperature>
				<t:value>
					<t:integer-part>33</t:integer-part>
					<t:fraction-part>12</t:fraction-part>
				</t:value>
				<t:unit>Centigrade</t:unit>
			</t:temperature>
			<t:time-stamp>03:00:00</t:time-stamp>
			<t:humidity>53</t:humidity>
		</t:measurement>
	</t:dailyMeasurement>
	<t:dailyMeasurement>
		<t:date>2011-01-01</t:date>
		<t:measurement>
			<t:temperature>
				<t:value>
					<t:integer-part>15</t:integer-part>
					<t:fraction-part>3</t:fraction-part>
				</t:value>
				<t:unit>Centigrade</t:unit>
			</t:temperature>
			<t:time-stamp>12:00:00</t:time-stamp>
			<t:humidity>43</t:humidity>
		</t:measurement>
	</t:dailyMeasurement>
	<t:dailyMeasurement>
		<t:date>2014-01-01</t:date>
		<t:measurement>
			<t:temperature>
				<t:value>
					<t:integer-part>40</t:integer-part>
					<t:fraction-part>50</t:fraction-part>
				</t:value>
				<t:unit>Centigrade</t:unit>
			</t:temperature>
			<t:time-stamp>12:00:00</t:time-stamp>
			<t:humidity>83</t:humidity>
		</t:measurement>
	</t:dailyMeasurement>
	<t:dailyMeasurement>
		<t:date>2014-01-01</t:date>
		<t:measurement>
			<t:temperature>
				<t:value>
					<t:integer-part>0</t:integer-part>
					<t:fraction-part>50</t:fraction-part>
				</t:value>
				<t:unit>Centigrade</t:unit>
			</t:temperature>
			<t:time-stamp>15:00:00</t:time-stamp>
			<t:humidity>83</t:humidity>
		</t:measurement>
	</t:dailyMeasurement>
	<t:dailyMeasurement>
		<t:date>2015-01-01</t:date>
		<t:measurement>
			<t:temperature>
				<t:value>
					<t:integer-part>0</t:integer-part>
					<t:fraction-part>50</t:fraction-part>
				</t:value>
				<t:unit>Centigrade</t:unit>
			</t:temperature>
			<t:time-stamp>15:00:00</t:time-stamp>
			<t:humidity>83</t:humidity>
		</t:measurement>
	</t:dailyMeasurement>
	<t:model name ="Honeywell TH"/>
	<t:user-ID>Namur-Barbi-1234</t:user-ID>
</t:thermostatData>
